{
  "id": "proof.logo-ticker",
  "kind": "section",
  "category": "PROOF",
  "source": {
    "id": "src:Logo/section",
    "tag": "section",
    "file": "src/components/Logo.jsx",
    "lines": "44-62"
  },
  "semantic": {
    "id": "proof.logo-ticker",
    "category": "PROOF"
  },
  "purpose": "State the positioning in one h3 and show partner proof in an endless ticker; hosts #send-scroll-trigger.",
  "implementedBy": "src/components/Logo.jsx",
  "region": "main",
  "anchorId": "logo-section",
  "tone": "light",
  "variants": [
    "statement-over-ticker"
  ],
  "handoff": {
    "observed": "light",
    "allowed": [
      "light",
      null
    ]
  },
  "constraints": {
    "onePerPage": true,
    "hostsTrigger": "send-scroll-trigger"
  },
  "content": {
    "statement": {
      "type": "text",
      "maxChars": 96,
      "maxWords": 17,
      "maxLines": 3,
      "linesNote": "measured at 1440x900",
      "evidence": [
        "copy.proof.logo-ticker.statement"
      ]
    },
    "supportLine": {
      "type": "text",
      "maxChars": 43,
      "maxWords": 5,
      "maxLines": 1,
      "linesNote": "measured at 1440x900",
      "evidence": [
        "copy.proof.logo-ticker.supportLine"
      ]
    },
    "partners": {
      "type": "list",
      "item": {
        "logo": {
          "type": "media",
          "roles": [
            "partner.logo",
            "placeholder.company-logo"
          ],
          "alt": {
            "maxChars": 10,
            "maxWords": 1,
            "evidence": [
              "copy.proof.logo-ticker.partnerName"
            ]
          },
          "aspect": "h 30, ratios 160/41,160/56,160/43,160/36",
          "evidence": [
            "spec.2.3-logo",
            "qa.09-partner-logo-ratios"
          ]
        }
      },
      "count": 4,
      "evidence": [
        "spec.2.3-logo"
      ]
    }
  },
  "generatedAssetRoles": [
    "placeholder.company-logo"
  ],
  "motion": {
    "reveal": [
      {
        "slot": "statement",
        "delay": 0.1,
        "amount": 0.5,
        "trigger": "inView",
        "clock": "trigger",
        "stagger": 0.06,
        "curve": "cubic-bezier(.16,1,.3,1)"
      }
    ],
    "ticker": {
      "velocityPxPerS": 50,
      "copies": 6,
      "gapPx": 48,
      "logoHeightPx": 30,
      "hoverPlaybackRate": 1
    },
    "reducedMotionFallback": "text-shown-ticker-static-handoff-static"
  },
  "motionEvidence": [
    "spec.3.2-reveal",
    "spec.3.7-ticker",
    "qa.01-ticker-no-hover-slowdown"
  ],
  "responsive": {
    "phone": [
      "h3 32px",
      "ticker container 593 wide",
      "pb 192"
    ],
    "tablet": [
      "ticker 1234 wide (594-1234)",
      "send trigger top:-432 (810-1199)"
    ],
    "desktop": [
      "ticker 1875 wide (1235-1875), 2516 >=1876",
      "pb 256"
    ]
  },
  "composes": [
    "primitive.reveal-text",
    "component.logo-ticker",
    "component.handoff",
    "primitive.media-image"
  ],
  "evidence": [
    "spec.2.3-logo",
    "src.logo.send-trigger",
    "src.app.composition",
    "ia.template-home"
  ],
  "copyPolicy": "Budgets are measured from the source layout; original strings are NOT stored. Write original copy within budget.",
  "retrievalEligible": true
}
